Question,Category
What are some effective exercises for building strong glutes?,1
How often should I change my workout routine for optimal results?,2
What's the proper form for a barbell squat?,1
Can you recommend a high-intensity interval training (HIIT) workout?,2
How do I prevent lower back pain during deadlifts?,1
What's a good pre-workout meal for energy?,2
What's the best way to increase my running endurance?,1
Can you suggest a workout plan for fat loss?,2
What's the recommended rest time between sets for muscle hypertrophy?,2
What are some ways to stay motivated to exercise regularly?,2
How do I target the inner chest during my chest workouts?,1
What's the importance of warming up before a workout?,2
Can you recommend exercises for improving flexibility?,1
How do I avoid overtraining and burnout?,2
What's the difference between free weights and machines for strength training?,1
What's the best time of day to work out for maximum benefits?,2
How can I incorporate more protein into my vegetarian diet for muscle building?,1
What's a good routine for a beginner in weightlifting?,2
How do I prevent muscle imbalances during my workouts?,1
Can you suggest exercises to relieve tightness in the shoulders and neck?,1
What's the role of recovery in muscle growth?,2
How do I choose the right weight for my strength training exercises?,1
Can you recommend a full-body workout for busy schedules?,2
What's the importance of proper hydration during exercise?,2
How can I improve my grip strength for deadlifts and pull-ups?,1
What's the best way to track progress in my fitness journey?,2
What are some effective exercises for targeting the hamstrings?,1
How do I adjust my workout routine for home workouts without equipment?,2
Can you suggest a routine for building lean muscle mass?,2
What's the proper form for a plank exercise?,1
How do I prevent muscle cramps during workouts?,2
What's the role of carbohydrates in pre-workout nutrition?,2
How can I improve my running speed and endurance?,1
Can you recommend exercises for strengthening the core?,1
What's the importance of a cooldown after a workout?,2
How do I avoid common mistakes in the deadlift exercise?,1
What's the best way to structure a workout for maximum fat burning?,2
Can you suggest a stretching routine for flexibility improvement?,1
How do I incorporate balance training into my workout routine?,1
What's the importance of consistency in fitness training?,2
Can you recommend exercises for building shoulder strength?,1
How do I choose the right shoes for different types of workouts?,2
What's the role of protein in muscle repair and growth?,2
How do I target the outer thighs for a well-rounded leg workout?,1
Can you suggest a workout routine for improving posture?,2
What's the best approach to prevent muscle soreness after a tough workout?,2
How can I vary my workouts to avoid boredom and plateaus?,2
What's the proper form for a bicep curl exercise?,1
How do I determine my one-rep max for strength training?,1
Can you recommend exercises for building a strong stable core?,1
What's the importance of a proper warm-up before cardio exercises?,2
How do I modify exercises for home workouts with minimal equipment?,2
What's the best way to recover from an intense workout?,2
Can you suggest a routine for improving cardiovascular health?,2
How do I prevent injuries during high-impact exercises?,1
What's the role of sleep in muscle recovery and overall fitness?,2
How can I incorporate mindfulness and relaxation into my fitness routine?,2
What's the importance of cross-training in a fitness program?,2
Can you recommend exercises for improving hip flexibility?,1
How do I target the upper chest during my chest workouts?,1
What's the best way to structure a workout for muscle endurance?,2
Can you suggest a workout plan for someone with limited time?,2
What's the proper form for a Romanian deadlift?,1
How do I avoid overtraining while still pushing my limits?,2
What's the role of nutrition in achieving fitness goals?,2
How can I prevent muscle imbalances between my right and left sides?,1
What's a good routine for increasing overall athletic performance?,2
How do I progress in my strength training exercises over time?,1
What's the best way to incorporate interval training into my routine?,2
Can you recommend exercises for building strong calves?,1
How do I choose the right workout intensity for my fitness level?,2
What's the importance of a cooldown after cardiovascular exercises?,2
How can I modify my workouts during pregnancy?,1
What's a good routine for improving flexibility in the lower back?,1
How do I prevent shoulder injuries during weightlifting?,1
What's the role of supplements in a fitness and nutrition plan?,2
Can you suggest a workout plan for enhancing overall mobility?,2
What's the proper form for a push-up exercise?,1
How do I adjust my workout routine for travel or limited equipment?,2
What's the best way to target the triceps during arm workouts?,1
Can you recommend exercises for building strong ankles?,1
How do I prevent muscle stiffness after long periods of sitting?,1
What's the importance of proper breathing during workouts?,2
How can I modify exercises for joint pain or pre-existing injuries?,1
What's a good routine for improving balance and coordination?,2
How do I progress in my flexibility training over time?,1
Can you suggest exercises for building strong lats?,1
What's the best way to structure a workout for muscle hypertrophy?,2
How do I avoid common mistakes in the bench press exercise?,1
What's the role of core strength in overall fitness?,2
Can you recommend a routine for improving agility and quickness?,2
What was my total workout time during yesterday's session?,3
What was my one-rep max on deadlifts last week?,3
Log 35 x 12 x 3 for the flat bench press,4
3 sets of 10 reps of dumbell curls,4
What was my total workout time during yesterday's session?,3
What was my one-rep max on deadlifts last week?,3
Log 35 x 12 x 3 for the flat bench press,4
3 sets of 10 reps of dumbbell curls,4
Can you log my 5K run from yesterday?,4
What was the weight progression in my squats during the last month?,3
How did my bench press performance compare to my last workout?,3
Log my 20-minute HIIT session today,4
What was my average heart rate during yesterday's cardio session?,3
How many calories did I burn in my workout yesterday?,3
What's the recommended rest time between sets for my current workout plan?,2
Can you suggest a new set of exercises for my next training split?,2
Log my recent yoga session including duration and intensity,4
What was the resistance level on the elliptical machine during my last session?,3
Can you recommend variations for my bicep workouts?,2
What's the best way to structure my workouts for a busy work schedule?,2
Log my leg day routine including weights and reps,4
How can I improve my deadlift form?,1
What's the correct technique for a kettlebell swing?,1
Log my recent spin class details including distance and resistance,4
What's a good warm-up routine for my upcoming strength training session?,2
Can you recommend exercises to target the obliques?,1
How can I incorporate more flexibility exercises into my routine?,2
What was my peak heart rate during yesterday's high-intensity interval training?,3
Can you log my recent 5K run including time and pace?,4
What's the best way to track my progress in bodyweight exercises?,2
Log my recent Pilates session details including exercises and duration,4
How can I optimize my nutrition for muscle recovery?,2
What's the recommended progression for my current weightlifting program?,2
Log my recent swim workout including laps and strokes,4
How can I modify my training routine for a home workout with minimal equipment?,2
What's the ideal tempo for my resistance training exercises?,2
Log my recent CrossFit workout including WOD details,4
What's the proper form for a Romanian deadlift?,1
Can you recommend exercises for building strong shoulders?,1
How can I prevent wrist pain during my weightlifting sessions?,1
Log my recent trail run including terrain and elevation,4
What's the best way to incorporate interval training into my cardio routine?,2
Can you recommend exercises for improving my running stride?,1
How do I adjust my workout routine during a busy travel schedule?,2
Log my recent barre class details including exercises and reps,4
What's the role of active recovery in my training program?,2
Can you suggest a new set of bodyweight exercises for my routine?,2
How do I target the lower abs during my core workouts?,1
What's the importance of cross-training for overall fitness?,2
Log my recent kickboxing session including techniques and intensity,4
What's a good routine for improving hip mobility?,1
How can I enhance my grip strength for better deadlift performance?,1
What's the recommended frequency for my current strength training program?,2
Log my recent rowing workout including distance and resistance,4
Can you recommend exercises for building strong triceps?,1
How do I avoid muscle imbalances in my upper body?,1
What's the best way to structure a workout for muscle hypertrophy?,2
Log my recent Zumba class including dance routines and intensity,4
How can I improve my push-up endurance?,1
What's the proper form for a plank exercise?,1
Log my recent cycling session including distance and speed,4
What's the role of deload weeks in my training program?,2
Can you recommend exercises for improving my squat depth?,1
How do I prevent shin splints during my running sessions?,1
Log my recent circuit training session including exercises and rounds,4
What's a good routine for improving ankle stability?,1
How can I optimize my nutrition for endurance training?,2
What's the proper form for a lateral raise exercise?,1
Log my recent dance class including routines and intensity,4
How do I adjust my workout routine for different phases of the menstrual cycle?,2
Can you recommend exercises for building strong forearms?,1
What's the importance of a proper cooldown after a high-intensity workout?,2
Log my recent TRX training session including exercises and sets,4
What's a good routine for enhancing overall flexibility?,2
How can I incorporate more variety into my cardio workouts?,2
What's the role of periodization in my strength training program?,2
Log my recent kettlebell workout including exercises and weights,4
What's the recommended rep range for my current muscle-building program?,2
Can you recommend exercises for improving my posture?,1
How do I avoid overtraining while still making progress?,2
Log my recent rock climbing session including routes and difficulty,4
What's a good routine for targeting the glutes?,1
How can I improve my grip strength for better pull-up performance?,1
What's the proper form for a barbell row exercise?,1
Log my recent martial arts training session including techniques and intensity,4
What's the importance of flexibility in preventing injuries during workouts?,2
Can you recommend exercises for building strong hamstrings?,1
How do I adjust my workout routine for seasonal changes?,2
Log yesterday's workout: 40kg x 12 x 3 bench press,4
Recent run: 5K in 25 mins details?,4
Record dumbbell curls: 15 lbs 3 sets of 10,4
Details on flat bench press: 50kg x 15 x 4,4
Log recent swim: 1500m in 30 mins,4
5K run yesterday: Time and pace?,4
Note 3 sets of 12 reps for leg press,4
Capture squat session: 80kg x 10 x 3,4
Log 30-minute HIIT: Exercises and intensity,4
Recent deadlifts: 100kg x 5 x 3 details?,4
Summarize lat pulldowns: 50kg x 10 x 3,4
Dumbbell rows: 25 lbs 3 sets of 12,4
Details on plank exercise: Held for 2 mins,4
Record 20-minute elliptical: Resistance level 12,4
Recent box jumps: 24 inches 3 sets of 10,4
Note push-ups: 50 in 3 sets,4
Detail 10K run: Completed in 55 mins,4
Log kettlebell swings: 15kg x 20 x 4,4
Capture recent leg curls: 40kg x 12 x 3,4
Outline recent cable flyes: 15kg x 15 x 3,4
Summarize 3 sets of 8 reps for overhead press at 25 pounds,4
Record bench press: 60kg x 8 x 4,4
Describe tricep dips: 3 sets of 12 reps,4
Recent jump rope session: 500 jumps in 10 mins,4
Log recent barbell row: 50kg x 10 x 3,4
Summarize leg press: 80kg x 15 x 3,4
Note reverse crunches: 3 sets of 15,4
Capture face pulls: 20kg x 15 x 3,4
Dumbbell curls: 12kg x 10 x 3 details?,4
Details on 3 sets of 12 reps for tricep kickbacks: 8kg each,4
Recent stair climbing workout: 30 floors in 15 mins,4
Log recent box squats: 60kg x 10 x 3,4
Capture recent Russian twists: 4 sets of 20 reps,4
Outline recent leg extensions: 30kg x 12 x 3,4
Summarize recent pull-ups: 3 sets of 8 reps,4
Dumbbell pullovers: 15kg x 12 x 3 details?,4
Record recent seated cable rows: 60kg x 12 x 3,4
Note recent preacher curls: 12kg x 10 x 3,4
Recent standing calf raises: 60kg x 20 x 3,4
Log recent hanging leg raises: 3 sets of 12 reps,4
Outline recent tricep rope pushdowns: 20kg x 15 x 3,4
Describe recent side plank holds: 2 mins per side,4
Details on recent medicine ball slams: 5kg ball 3 sets of 15,4
Summarize recent leg raise variations: 3 sets of 12 reps each,4
Record recent push press: 40kg x 10 x 3,4
Recent dumbbell lateral raises: 8kg x 15 x 3 details?,4
Log recent Bulgarian split squats: 20kg x 12 x 3,4
Capture recent chin-ups: 3 sets of 10 reps,4
Details on recent tricep overhead extensions: 12kg x 12 x 3,4
Recent seated leg curls: 35kg x 15 x 3 details?,4
Outline recent dumbbell hammer curls: 10kg x 12 x 3,4